{
  "schemaVersion": 1,
  "id": "transcript-2",
  "mediaVersionID": "media-2",
  "locale": "de-DE",
  "timingStatus": "verified",
  "origin": "userImport",
  "segments": [
    {
      "id": "seg-2-0",
      "text": "Ein verwalteter Cloud-Dienst kann den eigenen Betriebsaufwand fuer ein Modell verringern.",
      "range": {
        "startMs": 10000,
        "endMs": 26000
      },
      "final": true,
      "speakerLabel": "Sprecher A (synthetisch)"
    },
    {
      "id": "seg-2-1",
      "text": "Dafuer werden Netzanbindung und die Freigabe der Datenverarbeitung beim Dienst benoetigt.",
      "range": {
        "startMs": 30000,
        "endMs": 46000
      },
      "final": true,
      "speakerLabel": "Sprecher A (synthetisch)"
    },
    {
      "id": "seg-2-2",
      "text": "Dieser Vorteil gilt nicht fuer jeden Offline- oder Datenschutzbedarf.",
      "range": {
        "startMs": 50000,
        "endMs": 66000
      },
      "final": true,
      "speakerLabel": "Sprecher A (synthetisch)"
    }
  ]
}
