{
  "schemaVersion": 1,
  "id": "transcript-1",
  "mediaVersionID": "media-1",
  "locale": "de-DE",
  "timingStatus": "verified",
  "origin": "userImport",
  "segments": [
    {
      "id": "seg-1-0",
      "text": "Ein lokales Modell kann Anfragen ohne externen Modellanbieter verarbeiten.",
      "range": {
        "startMs": 10000,
        "endMs": 26000
      },
      "final": true,
      "speakerLabel": "Sprecher A (synthetisch)"
    },
    {
      "id": "seg-1-1",
      "text": "Der Betriebsaufwand bleibt eine eigene Aufgabe.",
      "range": {
        "startMs": 30000,
        "endMs": 46000
      },
      "final": true,
      "speakerLabel": "Sprecher A (synthetisch)"
    },
    {
      "id": "seg-1-2",
      "text": "Diese Einschätzung ist kein allgemeines Kostenversprechen.",
      "range": {
        "startMs": 50000,
        "endMs": 66000
      },
      "final": true,
      "speakerLabel": "Sprecher A (synthetisch)"
    }
  ]
}
