{
  "schemaVersion": 1,
  "id": "transcript-4",
  "mediaVersionID": "media-4",
  "locale": "de-DE",
  "timingStatus": "verified",
  "origin": "userImport",
  "segments": [
    {
      "id": "seg-4-0",
      "text": "Eine hybride Architektur kann lokale Grundfunktionen und verwaltete Zusatzfunktionen trennen.",
      "range": {
        "startMs": 10000,
        "endMs": 26000
      },
      "final": true,
      "speakerLabel": "Sprecher A (synthetisch)"
    },
    {
      "id": "seg-4-1",
      "text": "Die Schnittstellen und die Zustandsuebernahme brauchen dann eigene Tests.",
      "range": {
        "startMs": 30000,
        "endMs": 46000
      },
      "final": true,
      "speakerLabel": "Sprecher A (synthetisch)"
    },
    {
      "id": "seg-4-2",
      "text": "Mehr Komponenten sind nicht automatisch eine bessere Loesung.",
      "range": {
        "startMs": 50000,
        "endMs": 66000
      },
      "final": true,
      "speakerLabel": "Sprecher A (synthetisch)"
    }
  ]
}
