{
  "schemaVersion": 1,
  "id": "transcript-3",
  "mediaVersionID": "media-3",
  "locale": "de-DE",
  "timingStatus": "verified",
  "origin": "userImport",
  "segments": [
    {
      "id": "seg-3-0",
      "text": "Fuer Arbeiten ohne Netz braucht eine Anwendung einen verlaesslichen lokalen Pfad.",
      "range": {
        "startMs": 10000,
        "endMs": 26000
      },
      "final": true,
      "speakerLabel": "Sprecher A (synthetisch)"
    },
    {
      "id": "seg-3-1",
      "text": "Eine Cloudfunktion kann spaeter zusaetzliche Faehigkeiten bereitstellen.",
      "range": {
        "startMs": 30000,
        "endMs": 46000
      },
      "final": true,
      "speakerLabel": "Sprecher A (synthetisch)"
    },
    {
      "id": "seg-3-2",
      "text": "Die Architekturentscheidung haengt von der konkreten Ausfallsituation ab.",
      "range": {
        "startMs": 50000,
        "endMs": 66000
      },
      "final": true,
      "speakerLabel": "Sprecher A (synthetisch)"
    }
  ]
}
